{
	"name": "wheat",
	"displayName": "Wheat",
	"tier": "family",
	"icon": "wheat.svg",
	"attributes": ["../attributes/Protein.json"],
	"children": [
		{
			"name": "hard-red-spring-wheat",
			"displayName": "Hard Red Spring Wheat",
			"tier": "class",
			"icon": "wheat.svg",
			"attributes": [],
			"children": [
				{
					"name": "dark-northern-spring-wheat",
					"displayName": "Dark Northern Spring Wheat",
					"tier": "subclass",
					"icon": "wheat.svg",
					"attributes": [],
					"children": []
				},
				{
					"name": "northern-spring-wheat",
					"displayName": "Northern Spring Wheat",
					"tier": "subclass",
					"icon": "wheat.svg",
					"attributes": [],
					"children": []
				},
				{
					"name": "red-spring-wheat",
					"displayName": "Red Spring Wheat",
					"tier": "subclass",
					"icon": "wheat.svg",
					"attributes": [],
					"children": []
				}
			]
		},
		{
			"name": "hard-red-winter-wheat",
			"displayName": "Hard Red Winter Wheat",
			"tier": "class",
			"icon": "wheat.svg",
			"attributes": [],
			"children": []
		},
		{
			"name": "soft-red-winter-wheat",
			"displayName": "Soft Red Winter Wheat",
			"tier": "class",
			"icon": "wheat.svg",
			"attributes": [],
			"children": []
		},
		{
			"name": "hard-white-wheat",
			"displayName": "Hard White Wheat",
			"tier": "class",
			"icon": "wheat.svg",
			"attributes": [],
			"children": []
		},
		{
			"name": "soft-white-soft-shite-wheat",
			"displayName": "Soft White Soft Shite Wheat",
			"tier": "class",
			"icon": "wheat.svg",
			"attributes": [],
			"children": []
		},
		{
			"name": "soft-white-wheat",
			"displayName": "Soft White Wheat",
			"tier": "class",
			"icon": "wheat.svg",
			"attributes": [],
			"children": [
				{
					"name": "white-club-soft-white-wheat",
					"displayName": "White Club Soft White Wheat",
					"tier": "subclass",
					"icon": "wheat.svg",
					"attributes": [],
					"children": []
				},
				{
					"name": "western-white-soft-white-wheat",
					"displayName": "Western White Soft White Wheat",
					"tier": "subclass",
					"icon": "wheat.svg",
					"attributes": [],
					"children": []
				}
			]
		},
		{
			"name": "durum-wheat",
			"displayName": "Durum Wheat",
			"tier": "class",
			"icon": "wheat.svg",
			"attributes": [],
			"children": [
				{
					"name": "durum-durum-wheat",
					"displayName": "Durum Durum Wheat",
					"tier": "subclass",
					"icon": "wheat.svg",
					"attributes": [],
					"children": []
				},
				{
					"name": "hard-amber-durum-wheat",
					"displayName": "Hard Amber Durum Wheat",
					"tier": "subclass",
					"icon": "wheat.svg",
					"attributes": [],
					"children": []
				},
				{
					"name": "amber-durum-wheat",
					"displayName": "Amber Durum Wheat",
					"tier": "subclass",
					"icon": "wheat.svg",
					"attributes": [],
					"children": []
				}
			]
		}
	]
}
