{
	"name": "milled-rice",
	"displayName": "Milled Rice",
	"tier": "family",
	"icon": "rice.svg",
	"attributes": [],
	"children": [
		{
			"name": "second-head-milled-rice",
			"displayName": "Second Head Milled Rice",
			"tier": "class",
			"icon": "rice.svg",
			"attributes": [],
			"children": []
		},
		{
			"name": "screenings-milled-rice",
			"displayName": "Screenings Milled Rice",
			"tier": "class",
			"icon": "rice.svg",
			"attributes": [],
			"children": []
		},
		{
			"name": "brewers-milled-rice",
			"displayName": "Brewers Milled Rice",
			"tier": "class",
			"icon": "rice.svg",
			"attributes": [],
			"children": []
		}
	]
}
