{
	"name": "corn",
	"displayName": "Corn",
	"tier": "family",
	"icon": "corn.svg",
	"attributes": [],
	"children": [
		{
			"name": "yellow-corn",
			"displayName": "Yellow Corn",
			"tier": "class",
			"icon": "corn.svg",
			"attributes": [],
			"children": []
		},
		{
			"name": "white-corn",
			"displayName": "White Corn",
			"tier": "class",
			"icon": "corn.svg",
			"attributes": [],
			"children": []
		},
		{
			"name": "mixed-corn",
			"displayName": "Mixed Corn",
			"tier": "class",
			"icon": "corn.svg",
			"attributes": [],
			"children": []
		}
	]
}
