{
	"name": "dry-peas",
	"displayName": "Dry Peas",
	"tier": "family",
	"icon": "peas.svg",
	"attributes": [],
	"children": [
		{
			"name": "smooth-green-dry-peas",
			"displayName": "Smooth Green Dry Peas",
			"tier": "class",
			"icon": "peas.svg",
			"attributes": [],
			"children": []
		},
		{
			"name": "smooth-yellow-dry-peas",
			"displayName": "Smooth Yellow Dry Peas",
			"tier": "class",
			"icon": "peas.svg",
			"attributes": [],
			"children": []
		},
		{
			"name": "wrinkled-dry-peas",
			"displayName": "Wrinkled Dry Peas",
			"tier": "class",
			"icon": "peas.svg",
			"attributes": [],
			"children": []
		},
		{
			"name": "mottled-dry-peas",
			"displayName": "Mottled Dry Peas",
			"tier": "class",
			"icon": "peas.svg",
			"attributes": [],
			"children": []
		},
		{
			"name": "miscellaneous-dry-peas",
			"displayName": "Miscellaneous Dry Peas",
			"tier": "class",
			"icon": "peas.svg",
			"attributes": [],
			"children": []
		},
		{
			"name": "mixed-dry-peas",
			"displayName": "Mixed Dry Peas",
			"tier": "class",
			"icon": "peas.svg",
			"attributes": [],
			"children": []
		}
	]
}
