{
	"name": "rough-rice",
	"displayName": "Rough Rice",
	"tier": "family",
	"icon": "rice.svg",
	"attributes": [],
	"children": [
		{
			"name": "long-grain-rough-rice",
			"displayName": "Long Grain Rough Rice",
			"tier": "class",
			"icon": "rice.svg",
			"attributes": [],
			"children": []
		},
		{
			"name": "medium-grain-rough-rice",
			"displayName": "Medium Grain Rough Rice",
			"tier": "class",
			"icon": "rice.svg",
			"attributes": [],
			"children": []
		},
		{
			"name": "short-grain-rough-rice",
			"displayName": "Short Grain Rough Rice",
			"tier": "class",
			"icon": "rice.svg",
			"attributes": [],
			"children": []
		},
		{
			"name": "mixed-rough-rice",
			"displayName": "Mixed Rough Rice",
			"tier": "class",
			"icon": "rice.svg",
			"attributes": [],
			"children": []
		}
	]
}
