{
	"name": "brown-rice",
	"displayName": "Brown Rice",
	"tier": "family",
	"icon": "rice.svg",
	"attributes": [],
	"children": [
		{
			"name": "long-grain-brown-rice",
			"displayName": "Long Grain Brown Rice",
			"tier": "class",
			"icon": "rice.svg",
			"attributes": [],
			"children": []
		},
		{
			"name": "medium-grain-brown-rice",
			"displayName": "Medium Grain Brown Rice",
			"tier": "class",
			"icon": "rice.svg",
			"attributes": [],
			"children": []
		},
		{
			"name": "short-grain-brown-rice",
			"displayName": "Short Grain Brown Rice",
			"tier": "class",
			"icon": "rice.svg",
			"attributes": [],
			"children": []
		},
		{
			"name": "mixed-brown-rice",
			"displayName": "Mixed Brown Rice",
			"tier": "class",
			"icon": "rice.svg",
			"attributes": [],
			"children": []
		}
	]
}
